Date,Time Start,Time End ,Duration,GPS_File,Purpose
1/25/2018,10:00,12:30,2:30,,"Surveyed S. and N. Boating area. Found 3 whales, one group of 2 and a solo whale off West of Janis. Lots of rain and some snow. Wind was very high in the morning, and peaked again after 1130. Died down in the afternoon."
1/25/2018,14:30,18:10,3:40,,"Surveyed to BISCO island and embarked upon the island. Surveyed 2 whales, a mother and calf pair on the way down to BISCO. Heavy Snow, low wind and low vis."
1/26/2018,9:40,13:00,3:20,,Surveyed S. boating area and perfomred the FL Highway transect with the 120 kHz echosounder
1/26/2018,14:20,16:00,1:40,,"Surveyed N & S boating areas, no whales"
1/27/2018,9:30,12:00,2:30,,"Surveyed N and S Boating areas, 3 whales seen"
1/28/2018,9:40,12:00,2:20,,"Surveyed N and S Boating areas, 1 whale sighted. Blown out for the rest of the day."
1/29/2018,9:00,12:15,3:15,,"Surveyed N and S. boating areas, and performed the STN E express transect. No whales sighted, but HADAR observed whales near station E ~1130 transiting out of boating area.'"
1/29/2018,14:10,16:10,2:00,,"Surveyed N. and S. Boating Areas, sighted one humpback whale"
1/30/2018,10:10,11:20,1:10,,Ran Palmer Station prey-mapping transect on RIGIL using 38 and 120 kHz transducers. All groovy.
1/30/2018,13:10,17:50,4:40,,"Surveyed extended and standard boating areas, starting with northern boating area, transiting to dream, back down around the outside of Outcast Island, down to Biscoe, then back into the southern boating area. Encountered 4 whales outside Outcast Island (2 solitary, 1 pair), then 5 more whales near Biscoe (1 solitary, 1 group of 4)."
1/31/2018,9:00,10:30,1:30,,Surveyed Southern Boating Area. Found breaching mother and calf!
2/1/2018,9:40,15:00,5:20,,"Surveyed Southern boating area. Encountered 2 Humpback whales, and 1 Minke Whale. Biopsied 1 Minke."
2/2/2018,9:50,12:10,2:20,,"Surveyed Southern boating area, surveyed 4 Mn whales. Performed the Palmer Station trasect"
2/3/2018,-,-,,,"Poor Weather, no survey"
2/4/2018,9:40,12:40,3:00,,"Surveyed S and N boating areas. Found 6 whales (2 pairs, 2 solitary), collected 3 fluke photographs. 3 whales were not fluking at all, including a mother-calf pair that we monitored for 2 hours before abandoning."
2/4/2018,13:50,17:00,3:10,,"Surveyed N and S boating areas, found 3 whales (1 group), collected 3 fluke photos and 1 biopsy for a return visitor. Ran cormorant island transect."
2/5/2018,9:15,14:15,5:00,,"Surveyed N and S boating areas, found 2 solitary whales, ran station E transect."
2/8/2018,9:15,11:15,2:00,,"Surveyed N and S boating areas, found nothing, too windy to transect"
2/8/2018,15:15,18:15,3:00,,"Surveyed N and S boating areas, found 1 pair of whales, biopsied 1"
2/9/2018,9:25,10:55,1:30,,"Surveyed S and N boating areas, primarily inshore. Moderately high wind, very choppy waters, no whales seen."
2/10/2018,-,-,,,Weathered out
2/11/2018,9:40,17:30,7:50,,"Surveyed N. and Southern boating areas, encountered a mother/calf pair and a group of two humpbacks later in the evening, one of which was biopsied. Surveyed Joubin Islands with the birders throughout the mid day, and surveyed 11 Humpbacks, and 6 Biopsies."
2/12/2018,10:00,12:40,2:40,,"Ran Friedleisure Highway, aborted after ~75% due to ice"
2/14/2018,10:00,14:20,4:20,,"Surveyed Southern Boating Area. Sighted and Biopsied 2 Humpback whales, and sighted one Minke Whale. Performed the Cormorant transect and did an opportunistic krill survey around a foraging Humpback whale."
2/15/2018,13:20,17:50,4:30,,"Surveyed N and S boating areas. Sighted and biopsied 1 humpback whale, performed the Station E express transect."
2/16/2018,-,-,,,"Blown out, bad weather day"
2/17/2018,-,-,,,Sick Day :(
2/18/2018,9:40,13:00,3:20,,"Performed Palmer Station Transect, no whales seen"
2/18/2018,14:30,16:00,1:30,,"Surveyed southern and northern boating areas, no whales seen"
2/19/2018,9:40,12:15,2:35,,"Performed FL Highway transect, no whales seen, almost no krill seen on survey"
2/19/2018,14:30,16:55,2:25,,"N and S boating survey, one drone flight over crabeater, no whales seen."
2/20/2018,15:00,17:45,2:45,,"Two whaling boats surveyed southern boating area, and down to BISCOE. 2 Minke Whales Seen."
2/22/2018,10:10,11:40,1:30,,"N and S boating survey, inland only due to wind, no whales seen."
2/22/2018,13:50,14:20,0:30,,"4 whales seen foraging near Janus from station galley, high winds, quick expedition to photo ID, then returned to station"
2/23/2018,15:45,19:00,3:15,,"9 Whales seen, 3 biopsies collected, 4 calves seen. Surveyed Southern Boating Area."
2/25/2018,11:30,14:00,2:30,,"N and S boating survey, no whales seen"
2/25/2018,16:00,18:00,2:00,,"N and S boating survey, no whales seen"
2/26/2018,13:30,15:30,2:00,,"N and S boating survey, 2 humpbacks seen (mother and calf pair, mother biopsied), 1 minke seen but not biopsied."
2/26/2018,15:30,19:30,4:00,,"Surveyed to Gossler Islands and back, 1 humpback seen and biopsied at edge of N boating area."
2/27/2018,10:15,12:45,2:30,,"N and S boating survey, 1 solitary whale seen (disappeared without fluke or biopsy), 1 pair found transiting out of N boating limit, flukes and biopsies collected (UAS attempted without successful data collection)"
2/27/2018,16:30,17:30,1:00,,"N and S boating survey, no whales seen"
2/28/2018,10:45,13:45,3:00,,"N and S boating survey, found mother and calf pair in N boating area, biopsy and fluke for mother only"
2/28/2018,15:35,17:50,2:15,,"N and S boating survey, killer whales found in southern boating area"
3/1/2018,10:00,12:10,2:10,,"N and S boating survey, 2 humpback whales seen, with photo ID's and biopsies."
3/1/2018,15:00,17:00,2:00,,N and S boating survey. No whales seen.
3/2/2018,10:15,13:15,3:00,,N and S boating survey. 7 whales seen in N boating area (uncertain because of high snowfall and dense brash ice)
3/2/2018,14:45,16:45,2:00,,N and S boating survey. No whales seen.
3/3/2018,10:15,12:30,2:15,,"N and S boating survey, 3 whales seen in southern boating area (2 adults + 1 calf)"
3/3/2018,13:15,14:00,0:45,,"S boating area, same 3 whales as before"
3/4/2018,14:40,17:10,2:30,,N and S boating survey. 2 whales photod and biopsied
3/5/2018,10:30,17:30,7:00,,"N and S boating survey. 8 humpbacks encountered (2 adults + 1 calf, 2 adults, 1 adult, 1 adult + 1 calf), 7 flukes photo'd, 6 biopsies collected. 1+ minke found multiple times over 3 hours."
3/6/2018,10:45,14:20,3:35,,"Surveyed N and S boating area, surveyed 6 whales and biopsied 2 individuals. One individual was biopsied twice."
3/8/2018,9:45,12:00,2:15,,"Surveyed N and S boating area, 2 whales in S boating area, collected flukes and biopsies."
3/8/2018,14:00,16:45,2:45,,"Surveyed N and S boating area. Mother calf pair survyed, mother was biopsied."
3/9/2018,10:00,15:50,5:50,,"Surveyed to Gossler Islands and back, no whales seen on that trip. 1 humpback mother/calf pair seen and biopsied in the S boating area."
3/11/2018,11:45,13:15,1:30,,N and S boating survey. No whales seen.
3/11/2018,16:10,18:00,1:50,,N and S boating survey. No whales seen.
3/12/2018,9:35,14:35,5:00,,"Surveyed N boating area, then Joubins, then Dream, then N boating area, then S boating area. Found 2 whales (M-C pair) at the start, encountered again at Dream, then encountered 1 solo adult near N boating area in the afternoon. Biopsied only the mother of the M-C pair."
3/14/2018,15:10,17:30,2:20,,"Surveyed S boating area down to Biscoe. No whales seen. Hadar also surveyed N boating area simultaneously, no whales seen."
3/16/2018,10:30,12:00,1:30,,"Surveyed S boating area, no whales seen, bad swell, returned to station."
3/16/2018,13:50,15:20,1:30,,N and S boating survey. No whales seen.
3/17/2018,10:00,13:00,3:00,,"S boating area, found mother and calf pair, then Palmer station transect."
3/18/2018,11:10,14:10,3:00,,"Echosounder surveyed Friedleisure HWY, no whales seen"
3/18/2018,14:00,15:40,1:40,,N and S boating survey. No whales seen.
3/19/2018,9:50,11:30,1:40,,"Survey of Northern Boating Area, 2 whales seen and Biopsied."
3/26/2018,10:40,12:40,2:00,,"N and S boating survey. 1 whale seen in S, fluke no biopsy. 2 whales reported in N boating area, not found."
3/26/2018,13:45,16:00,2:15,,"Surveyed S boating area, 2 whales seen, no fluke or biopsy possible before they exited the boating area."
3/29/2018,9:50,11:45,1:55,,"N and S boating survey. Mother-calf pair seen in N, biopsy and fluke from mother. 4 adults seen in S, all biopsied, 3 flukes."
3/30/2018,9:45,11:15,1:30,,"S boating survey. 2 whales seen, no fluke or biopsy, weather recall."
3/30/2018,15:10,17:10,2:00,,"N and S boating survey. 3 whales surveyed (more seen, one more fluke photographed incidentally)"
3/31/2018,9:10,12:30,3:20,,"S boating survey, 4 whales surveyed, then Cormorant transect."
4/1/2018,1:40,4:40,3:00,,"N and S boating area and norsel to halfway. Saw a mother-calf pair near Laggard, could not get more than dorsals owing to the bad swell."
4/3/2018,8:45,13:32,4:47,,Survey of Northern and Southern Boating. No whales seen.
1/8/2019,8:00,17:30,9:30,,Out to Gossler islands to help set up weather station
1/9/2019,9:30,11:45,2:15,,"North and south boating looking for whales, no whales found, lots of brash ice"
1/10/2019,,,0:00,,winds were to high
1/11/2019,8:05,11:00,2:55,,"Did north and south survey, found three whales in south end near stepping stone island. Were feeding. "
1/11/2019,13:00,15:00,2:00,,"Did north and south survey, found whales from survey 1 and some near halfway that we could not get, trying to get extened after dinner"
1/11/2019,18:45,21:00,2:15,,"Went to halfway/dream with second boat, ~8 whales in area, three from survey one again. Got three samples. One mom calf"
1/12/2019,8:45,12:30,3:45,,"biscoe with birder, saw four whales in biscoe and one in boating area. No samples. "
1/13/2019,13:15,19:15,6:00,,"Extended boating, dream and biscoe, 4 samples. One mom calf pair"
1/14/2019,13:15,15:15,2:00,,"North and south boating, 1 whale seen in Wiley (not reachable), mother calf pair by Station E"
1/15/2019,8:00,19:00,11:00,,"North boating area (2 adults near Litchfield), Joubins (2 adults en route by boating limit), Gosslers (2 adults outside the islands from Joubins), Dream (2 adults on Nightmare side), Wiley Cove (1 adult), North boating area (1 adult, sample and bolt lost)."
1/16/2019,8:45,11:15,2:30,,"South boating area (5 animals between Bonaparte and Friedleisure Cove: mother, calf, escort + 2 randos)"
1/17/2019,9:15,10:45,1:30,,"North and south boating area, no animals, lots of ice. "
1/17/2019,15:00,21:00,6:00,,"South boating area, found two animals logging near station E around 3:30 pm then everything went crazy and ~20 animals showed up in the vicinity feeding all around us, both lunge and bubble net. Got 12 samples. "
1/18/2019,9:00,13:00,4:00,,"North boating area, tons of animals in wiley bay, 8 samples. And a few animals from yesterday"
1/19/2019,,,0:00,,"Poor weather, housekeeping/catchup day; whales sighted off bonaparte"
1/20/2019,9:45,11:45,2:00,,"5 whales: 2 feeding off bonaparte for the entire effort duration, 1 singleton traveling between hermit and outcast; 2 traveling between spume and janus"
1/20/2019,14:15,17:15,3:00,,"2 whales (mother+calf) feeding off Lipps, joined with 2 more whales in Wylie; sampled 3 (no calf); found 7 more whales (4-group + 3-group including calf) feeding near glacier in Wylie. Sampled apparent mother in the 3-group."
1/21/2019,,,0:00,,"winds were to high, did data management, however, Hadar reported groups of whales off cormorant and near Biscoe bay. "
1/22/2019,9:30,17:30,8:00,,"Acompianied the moss group to the Joubins and worked on animals on the way there and back, and while they were on land. We saw ~20 animals. Got 2 samples and multiple photo id's"
1/23/2019,9:00,15:30,6:30,,"Did our wauerman's and palmer deep transect, 5 whales on the way out near the canyon, and then no whales, but a lot of gentoos near Wauerman's. On transect back, whales everywhere near the caynon finger. 7 Biopsies, 8 non-biopsied photo-ids. "
1/24/2019,,,0:00,,"Poor weather, housekeeping/catchup day; whales sighted off bonaparte"
1/25/2019,,,0:00,,"Poor weather, housekeeping/catchup day; whales sighted off bonaparte, went on Seaborne Quest"
1/26/2019,8:50,12:10,3:20,,"North and south boating area, 3 biopsies in North boating area, 5 transiting in south boating area. Got 4 biopsies. All animals transitting today, no feeding and all appeared to be heading North West. "
1/26/2019,16:00,17:50,1:50,,"North and south boating area, water was glass, saw one blow out by outcasts, waited ~30 minutes for it to reappear and never saw it again!"
1/27/2019,9:30,11:00,1:30,,"North and south boating area, bit of wind, no whales "
1/27/2019,13:15,17:30,4:15,,"Got a call from Birders of a Minke off shortcut, approached but couldn’t get close then went to Dream, Wiley bay and saw no whales. Came back to original minke whale sighting and got one minke smaple and saw two humpbacks. One humpback we sampled (B), and the partner we sampled on the 15th (15H)"
1/28/2019,10:45,17:00,6:15,,"North and South boating, found 4 whales (3 and a calf) near Janice, 3 biopsies. Then acompianed birders to Joubins. Routed back past dream. Found a juvenile, mom and calf. Got two samples. "
1/29/2019,13:00,15:00,2:00,,"North and South boating, found 2 whales SE of outcast, just outside the boating limit, got photos no biopsies"
1/29/2019,16:00,21:00,5:00,,"Joubins with birders, on way back found juvenile from yesterday, found MCE (E from yesterday, M biopsied) in Wylie; found 2 more foraging off bonaparte, sampled 1 and struck out on 2"
1/30/2019,,,,,"Lots of fog/rain, Logan went and did humpble loop with birders"
1/31/2019,9:00,15:45,6:45,,"South boating area, found 2 juveniles, lost and recovered dart from 2nd biopsied juvie. Joined birders, found feeding frenzy in Wylie bay, sampled 1 animal (GDL struck out on another animal). Went to Joubins, came back, revisited feeding frenzy, estimated 20 whales in Wylie Bay. Biopsied 5 more with fluke IDs, saw a couple that had been seen earlier too."
1/31/2019,19:00,20:30,1:30,,"North boating area to check out by Wiley bay. Saw two humpbacks, one from this morning that we missed and got a sample. Also saw one minke whale. "
2/1/2019,9:45,10:30,0:45,,"North and south boating area, large surface chop, poor sighting and biopsy conditions. Saw one repeat whale. "
2/2/2019,8:45,12:45,4:00,,"Whales near spume, then escorted birders to Joubins, sighted whales on way there and back; worked whales back in the boating area, at southwestern limit, then into the boating area toward bonaparte. Sampled 3 whales total, confirmed presence of 4 return whales from earlier in the week (dairy cow, blackie, juvie, white tail with lower left black mark)"
2/2/2019,16:15,17:15,1:00,,"North boating area, 5 animals lunge feeding in very short internvals at surface. Two new animals and three previous animals. "
2/4/2019,15:00,17:00,2:00,,"Transited from Palmer Station to Palmer Canyon on Rigil (RHIB) to look for tag 22. Visited the last 2 argos locations, spent 1+ hour listening, did not detect tag. Transited home, did not see any whales at all for the duration of the trip."
2/5/2019,8:00,10:15,2:15,,Suction cup tag 22 recovery for RN with help of MTs down to Wauwermans Islands. Saw some whales transitting down and back
2/5/2019,16:00,17:45,1:45,,North boating area off Norsel Point. 15-20 animals. 
2/6/2019,9:00,11:30,2:30,,"Tag retrieval: transited to Palmer Canyon, retrieved tag (Mr. T), transited to Killer Whale Rocks, through Janus/Delaca, retrieved second tag at Surge Rocks. For duration of time on the water, saw 20-30 whales between Station E and Janus. 5 sightings, a few flukes recorded."
2/6/2019,13:00,14:20,1:20,,"North boating area, large aggregation of animals, with scattered small groups between Station E and Wiley Bay. Biopsied 2 mothers with calves, collected many flukes."
2/7/2019,9:00,11:30,2:30,,Suction cup tag 27 and tag 40 recovery. Observed whales everywhere
2/7/2019,13:00,14:30,1:30,,"Biopsy and photo id with whole whale gang, Michelle biopsied two animals. 30-50 animals near palmer. "
2/8/2019,13:45,15:15,1:30,,"North and south boating area; small feeding group of adults (sampled 2) near Bonaparte; saw 1 animal by Laggard; many in Palmer Canyon; found many feeding groups in Wylie Bay, most were surveyable within the northern limits. Saw 2 mothers that were sampled yesteday by Michelle"
2/9/2019,16:30,20:45,4:15,,"Forgot to do GPS track, but basically transited to Joubins, hung out at Island 8 for a while, transited toward Dream, then to halfway and home. Saw scattered whales on the way out, large aggregation on our way out of Joubins, and medium aggregation at halfway. Connect the sightings for our effective GPS track."
2/11/2019,10:00,12:30,2:30,,Surveyed north and south boating area
2/12/2019,9:30,11:30,2:00,,"Tagged in north boating area, by litchfield and lipps"
2/12/2019,14:30,17:00,2:30,,"Surveyed north and south boating area; feeding aggregation of ~12 whales around Bonaparte pt., including the 2 tagged whales from this morning"
2/13/2019,9:50,11:50,2:00,,"Tag retrieval: transited 3/4 of the way to Biscoe and retrieved tags 40 and 27. Sighted whales at 2nd tag retrieval and on the way back to station; collected a few flukes. Winds picked up after noon, expect no further surveys today."
2/14/2019,9:30,11:45,2:15,,Accompanied the birdersa all the way to biscoe. Found abour 10 whales feeding and transitting. Sampled two then returned to station.
2/14/2019,18:30,20:00,1:30,,"Surveyed the northern boating area and wiley bay. Saw one mother calf pair - Mn19_038A_P who had been seen a week prior, and multiple times in between with her calf in the northern boating area."
2/15/2019,9:00,12:00,3:00,,"Tag deployment with Solas (Mia) and Hadar to accompany. Deployed tag 40 on Mn19_038A_P in Wiley Bay, performed 2 hour echosounder transect around foraging whales."
2/16/2019,10:00,12:30,2:30,,"Retrieved tag from deep in the Palmer Canyon. High winds and swell, no whales seen on transit to or from."
2/17/2019,12:30,19:30,7:00,,"Transited to Joubins, no whales; spent 5 hours in Joubins, no whales; transited back from Joubins, no whales; found 3 (MCJ) in Wylie Bay."
2/18/2019,9:30,15:30,6:00,,"Transited to Biscoe and back, no whales. Spent 5 hours in Biscoe."
2/18/2019,5:00,8:00,3:00,,"Transited to Joubins, worked a MC pair; stayed at Joubins for 2 hours; transited to dream, then home, no whales"
2/19/2019,9:45,12:45,3:00,,"N+S boating area, found 2 adults transiting near Station E"
2/19/2019,15:30,17:30,2:00,,"N+S boating area, found MC in Wylie, was same MC pair seen yesterday"
2/20/2019,9:15,10:45,1:30,,"N+S boating area, found 2 adults feeding NW of Litchfield, and the MC seen the past 2 days"
2/21/2019,14:30,20:15,5:45,,"Northern Boating area, then trip to Joubins. 5 whales seen. GPS track line is in 2/22/2019 trackline file"
2/22/2019,9:45,12:00,2:15,,"N+S Boating area. Saw one whale, performed one drone flight over whale. Attempted drone flight over Torgeson Island"
2/22/2019,14:00,18:30,4:30,,"N Boating area and to Joubin Islands. 3 whales seen between N boating and Joubins, 5 whales seen out of range while at Joubins."
2/23/2019,9:30,12:30,3:00,,"N+S boating area, only 1 whale beyond station E and boating limit. Flew UAS survey over Humble Island."
2/23/2019,16:30,18:15,1:45,,"N boating area, worked 4 whales at Outcast, got all flukes, 3 photogrammetry. GPS did not appear to record track, for reasons unknown."
2/24/2019,10:00,14:30,4:30,,"Extended boating with rec boater as secondary boat. Trip to Dream Island (Effort wasn;t logged in GPS due to malfunctioning GPS. Went straight from Palmer to Dream). After Dream, went to Humble Island, then to Outcast, then to Biscoe. 10 animals outside and around Outcast Island."
2/24/2019,17:30,19:15,1:45,,"Transit around the southern boating area and to Outcast, drone flight over group of 3 whales seen earlier in the day."
2/25/2019,9:30,12:30,3:00,,"Outcast to southern boating area, found 1 single whale (flew drone) and a group of 4 whales (flew drone) including Rakey fluke from previous days."
2/25/2019,14:20,18:00,3:40,,"Outcast, southern boating area - found 3 whales, seen and flown before - then flew mapping survey over Torgersen Island"
2/26/2019,9:30,12:45,3:15,,Transited to Outcast Island and around southern boating area. Saw two groups here. Went to Norsel point and found one more group. Drone flights over all three.
2/26/2019,15:00,18:00,3:00,,"Transited to Southern Boating area and found 3 groups including a group found earlier in the day that had moved into to Bonaparte point. Drone flights over the 2 new groups, data obtained for the 2nd (first had no SD card womp womp)"
2/27/2019,10:20,12:00,1:40,,"N+S boating area, 5 whales north of Delaca (2 mc pairs + 1 rando)"
2/27/2019,15:50,17:30,1:40,,"N+S boating area, no whales"
2/28/2019,9:30,11:30,2:00,,"N boating area, no whales, drone mapped Elephant Rocks"
2/28/2019,12:45,19:45,7:00,,"Joubins with birders, no whales out there, on way back found 5 outside Outcast"
3/1/2019,9:30,12:00,2:30,,Surveyed southern and northern boating areas. One mom-calf pair. Performed UAV flight of mother and calf and biopsy of mother.
3/1/2019,13:45,15:45,2:00,,Flew mapping survey of Humble Island
3/2/2019,9:30,13:00,3:30,,"Southern boating area, pursued 1 minke whale (no biopsy), flew over 1 mother-calf pair and biopsied mother. Sighted other whales, but all were gone by the time we concluded with MC pair."
3/3/2019,10:30,16:30,6:00,,"Dream to Biscoe, worked 3 adults traveling from Cormorant to Outcast, sighted 1 minke near Biscoe"
3/4/2019,,,0:00,,"Wet weather, needed to catch up on housekeeping etc., took a day off"
3/5/2019,10:00,12:15,2:15,,"Surveyed southern boating area, found 2 mc pairs, 2 solitary humpbacks (1 a calf), 1 minke. Sampled minke and 3 adults. Did not fly because not comfortable in the Solas. Switching to Zodiac for the afternoon."
3/5/2019,14:00,18:00,4:00,,"N boating area, found many whales, flew over 3 groups (mc, mc, mce/j), spotted more (2 in distance) including 1 minke. Note that GPS was left in the boat (oops) so trackline includes rec boating after 1800. Be sure to omit if considering trackline for effort."
3/6/2019,9:45,11:15,1:30,,"N+S boating area, snow and low visibility (1-3 km). No whales seen"
3/6/2019,14:45,17:30,2:45,,"N+S boating area, snow and low visibility (1-3 km). No whales seen. Mapped Torgersen."
3/7/2019,10:00,12:30,2:30,,"N+S Boating area, no whales seen. Mapped Elephant Rocks"
3/7/2019,14:30,16:00,1:30,,"N+S Boating area, no whales seen. Began mapping Shortcut Island, lost drone to catastrophic mechanical failure."
3/8/2019,13:00,16:30,3:30,,"N+S Boating area, 2 whales spotted in southern boating area."
3/9/2019,10:15,12:45,2:30,,"N+S Boating area, no whales, climbed Hermit, saw no whales."
3/10/2019,10:45,16:15,5:30,,"Extended boating, dream and biscoe, 1 sample"
3/11/2019,9:10,11:40,2:30,,"N+S+N boating area, no whales"
3/12/2019,8:00,9:30,1:30,,"N+S boating area, no whales"
3/18/2019,,,0:00,,"Weather to bad, winds exceeding 20Knts Did not go out. Worked on stuff at station"
1/3/2020,18:40,21:50,3:10,,"N boating area, found many feeding groups due north of Outcast Islands, with some transiting animals. Group sizes ranged from 1 to 4."
1/11/2020,,,3:00,,"Effort not taken, estimated post hoc"
1/13/2020,,,3:00,,"Effort not taken, estimated post hoc"
1/14/2020,8:40,10:20,1:40,Track_2020-01-14 211044.gpx,"N, S boating area"
1/14/2020,17:45,20:50,3:05,Track_2020-01-14 211044.gpx,"N boating area, Wylie Bay, Outcast Islands, no whales at all"
1/15/2020,16:15,19:15,3:00,Track_A020-01-15 195030,"Wylie Bay, found a few whales, very scattered and ephemeral, 3 flown, 3 biopsied, 3 fluked, not sure how they match"
1/17/2020,8:45,11:45,3:00,,"Found multiple groups between Humble and Outcast, flew 6, fluked 5 biopsied 4"
1/17/2020,19:30,21:15,1:45,,Single animal near Station E
1/18/2020,8:45,11:45,3:00,,"Single whale in middle boating area, got away without biopsy; two minkes near cormorant; one more near "
1/18/2020,19:00,21:30,2:30,,"Whaling with support boat, found MC pair in middle/S boating area, minke and humpback near Loaf rock"
1/19/2020,17:25,20:10,2:45,,"N + S boating area, single humpback near Jacobs; more seen from glacier toward Bismark"
1/20/2020,19:10,19:50,0:40,,"Marginal wind all day; drove down from Humble to Cormorant and back, saw a single humpback just south of Cormorant"
1/21/2020,9:20,11:00,1:40,,"N + S boating area, two humpbacks between laggard and hermit"
1/21/2020,13:10,18:10,5:00,,"S + extended to Biscoe, bunch o' whales"
1/22/2020,8:30,11:30,3:00,,"S, extended to Biscoe, and central boating area (bonaparte); resighted G and H from yesterday, and chased a minke into the northern islands"
1/23/2020,10:15,12:15,2:00,,"Couple minkes in the N boating area, and a sleepy humpback that disappeared"
1/23/2020,16:10,18:10,2:00,,"Bunch of whales feeding between Wylie and Litchfield, 8-10 total"
1/24/2020,8:20,9:20,1:00,,"Found 2 whales in Wylie, tagged 1"
1/24/2020,13:10,17:40,4:30,,"Transited to the Joubins, looked around, did some island ops, transited back. Only saw whales off in the distance of the Bismark"
1/25/2020,16:10,18:15,2:05,,"North and south boating area, found 2 in south, a bit swelly"
1/26/2020,15:45,17:00,1:15,,"North boating area, found 5 whales around Outcast Islands"
1/28/2020,9:30,16:15,6:45,,"Dream, Joubins, saw 1 whale at Dream, did not work it up"
1/29/2020,9:30,12:00,2:30,,"N and part of S boating areas, found single, double, single, double"
